StartDate,EndDate,Status,IPAddress,Progress,Duration (in seconds),Finished,RecordedDate,ResponseId,RecipientLastName,RecipientFirstName,RecipientEmail,ExternalReference,LocationLatitude,LocationLongitude,DistributionChannel,UserLanguage,QID_1,QSM01,QSM01_8_TEXT,QSM02,QSM03,QSM04,QSM04_6_TEXT,QSM05,QSM05_4_TEXT,QSM06,QSM06_8_TEXT,QSM07,QSM07_8_TEXT,QSM08,QSM09,QSM10,QSM11,QSM12,Q1_8_TEXT - Parent Topics,Q1_8_TEXT - Topics,Q1_8_TEXT - Topic Hierarchy Level 1
Start Date,End Date,Response Type,IP Address,Progress,Duration (in seconds),Finished,Recorded Date,Response ID,Recipient Last Name,Recipient First Name,Recipient Email,External Data Reference,Location Latitude,Location Longitude,Distribution Channel,User Language,Enter the number at the top of your informed consent form. - Number:,Which social media platforms do you use? Select all that apply: - Selected Choice,Which social media platforms do you use? Select all that apply: - Other - Text,How often do you post or respond on social media?,How often do you view content on social media without responding?,When do you use social media? - Selected Choice,When do you use social media? - Other - Text,What devices do you generally use to access social media? - Selected Choice,What devices do you generally use to access social media? - Other - Text,What are your main reasons for using social media? - Selected Choice,What are your main reasons for using social media? - Other - Text,Which of the following do you most often use as your main sources of news?  Select all that apply: - Selected Choice,Which of the following do you most often use as your main sources of news?  Select all that apply: - Other - Text,I feel comfortable being close friends with someone who holds very different political beliefs from me.,I use social media to consume news about political topics.,I frequently encounter political discussion online (whether or not I participate).,I frequently participate in political discussion online.,I feel safe expressing my opinions on social media.,Q1_8_TEXT - Parent Topics,Q1_8_TEXT - Topics,Q1_8_TEXT - Topic Hierarchy Level 1
"{""ImportId"":""startDate"",""timeZone"":""America/Denver""}","{""ImportId"":""endDate"",""timeZone"":""America/Denver""}","{""ImportId"":""status""}","{""ImportId"":""ipAddress""}","{""ImportId"":""progress""}","{""ImportId"":""duration""}","{""ImportId"":""finished""}","{""ImportId"":""recordedDate"",""timeZone"":""America/Denver""}","{""ImportId"":""_recordId""}","{""ImportId"":""recipientLastName""}","{""ImportId"":""recipientFirstName""}","{""ImportId"":""recipientEmail""}","{""ImportId"":""externalDataReference""}","{""ImportId"":""locationLatitude""}","{""ImportId"":""locationLongitude""}","{""ImportId"":""distributionChannel""}","{""ImportId"":""userLanguage""}","{""ImportId"":""QID16_1""}","{""ImportId"":""QID14""}","{""ImportId"":""QID14_8_TEXT""}","{""ImportId"":""QID2""}","{""ImportId"":""QID6""}","{""ImportId"":""QID3""}","{""ImportId"":""QID3_6_TEXT""}","{""ImportId"":""QID4""}","{""ImportId"":""QID4_4_TEXT""}","{""ImportId"":""QID5""}","{""ImportId"":""QID5_8_TEXT""}","{""ImportId"":""QID7""}","{""ImportId"":""QID7_8_TEXT""}","{""ImportId"":""QID8""}","{""ImportId"":""QID10""}","{""ImportId"":""QID11""}","{""ImportId"":""QID12""}","{""ImportId"":""QID13""}","{""ImportId"":""QID14_8_TEXT_95e579e5_cg0zaxi0gw5dParTopics""}","{""ImportId"":""QID14_8_TEXT_95e579e5_cg0zaxi0gw5dTopics""}","{""ImportId"":""QID14_8_TEXT_95e579e5_cg0zaxi0gw5dTopicHierarchy1""}"
2025-12-01 14:06:16,2025-12-01 14:08:47,IP Address,199.111.65.11,100,150,True,2025-12-01 14:08:47,R_6M0cYA2UeUswFCQ,,,,,38.3,-77.4739,anonymous,EN,2045,"Instagram,Facebook,TikTok",,Never,Every day,"Relaxing,Throughout the day,During meals,While commuting or walking,Before bed or when waking up",,Phone,,"To stay in touch with friends or family,To follow news or current events,To learn about specific topics or hobbies,For entertainment,To follow celebrities, influencers, or public figures",,"Online articles from established news organizations (e.g., CNN, BBC, The New York Times),Friends or family,Social media (X, Instagram, Reddit, Facebook, TikTok, TruthSocial, Bluesky, or others)",,Neutral,Disagree,Disagree,Strongly disagree,Strongly disagree,,,
2025-12-01 14:06:11,2025-12-01 14:09:05,IP Address,199.111.65.11,100,174,True,2025-12-01 14:09:05,R_5dMozbOnuJTpkwQ,,,,,38.3,-77.4739,anonymous,EN,2054,"Instagram,Reddit,Facebook,Other",YouTube,Never,Every day,"Relaxing,Throughout the day,During meals,Before bed or when waking up",,"Phone,Laptop",,"To stay in touch with friends or family,To learn about specific topics or hobbies,For entertainment,To follow celebrities, influencers, or public figures",,"Television news broadcasts,Friends or family,Social media (X, Instagram, Reddit, Facebook, TikTok, TruthSocial, Bluesky, or others)",,Agree,Agree,Agree,Strongly disagree,Strongly disagree,,Unknown,
2025-12-01 14:06:11,2025-12-01 14:09:10,IP Address,199.111.65.11,100,178,True,2025-12-01 14:09:11,R_7D0J2Qtq2VrLrMA,,,,,38.3,-77.4739,anonymous,EN,2009,"Instagram,Facebook,TikTok",,Less than once a month,Every day,"Relaxing,Throughout the day,During meals,Before bed or when waking up",,Phone,,"To stay in touch with friends or family,To follow news or current events,To learn about specific topics or hobbies,For entertainment,To follow celebrities, influencers, or public figures",,"Television news broadcasts,Online articles from established news organizations (e.g., CNN, BBC, The New York Times),Social media (X, Instagram, Reddit, Facebook, TikTok, TruthSocial, Bluesky, or others)",,Neutral,Agree,Agree,Strongly disagree,Disagree,,,
2025-12-01 14:07:11,2025-12-01 14:09:24,IP Address,199.111.65.11,100,133,True,2025-12-01 14:09:25,R_35u2HrHbLKo6JGg,,,,,38.3,-77.4739,anonymous,EN,2027,Other,youtube,Never,Every day,"Relaxing,During meals",,"Laptop,Other",tv,"To follow news or current events,To learn about specific topics or hobbies,For entertainment",,"Online articles from established news organizations (e.g., CNN, BBC, The New York Times)",,Strongly agree,Disagree,Disagree,Strongly disagree,Neutral,,Unknown,
2025-12-01 14:08:05,2025-12-01 14:09:46,IP Address,199.111.65.11,100,101,True,2025-12-01 14:09:46,R_7iwEBRlRWbchUaE,,,,,38.3,-77.4739,anonymous,EN,2036,"X (Twitter),Instagram,Reddit,TikTok",,Every day,Every day,"Relaxing,Throughout the day,During meals,Before bed or when waking up",,"Phone,Laptop",,"To learn about specific topics or hobbies,For entertainment,To post about your personal life or opinions,To follow celebrities, influencers, or public figures",,"Online articles from established news organizations (e.g., CNN, BBC, The New York Times),Online articles or posts from other sources (e.g., blogs, social media, independent websites),Social media (X, Instagram, Reddit, Facebook, TikTok, TruthSocial, Bluesky, or others)",,Neutral,Agree,Strongly agree,Neutral,Strongly disagree,,,
