StartDate,EndDate,Status,IPAddress,Progress,Duration (in seconds),Finished,RecordedDate,ResponseId,RecipientLastName,RecipientFirstName,RecipientEmail,ExternalReference,LocationLatitude,LocationLongitude,DistributionChannel,UserLanguage,QID_1,QSM01,QSM01_8_TEXT,QSM02,QSM03,QSM04,QSM04_6_TEXT,QSM05,QSM05_4_TEXT,QSM06,QSM06_8_TEXT,QSM07,QSM07_8_TEXT,QSM08,QSM09,QSM10,QSM11,QSM12,Q1_8_TEXT - Parent Topics,Q1_8_TEXT - Topics,Q1_8_TEXT - Topic Hierarchy Level 1
Start Date,End Date,Response Type,IP Address,Progress,Duration (in seconds),Finished,Recorded Date,Response ID,Recipient Last Name,Recipient First Name,Recipient Email,External Data Reference,Location Latitude,Location Longitude,Distribution Channel,User Language,Enter the number at the top of your informed consent form. - Number:,Which social media platforms do you use? Select all that apply: - Selected Choice,Which social media platforms do you use? Select all that apply: - Other - Text,How often do you post or respond on social media?,How often do you view content on social media without responding?,When do you use social media? - Selected Choice,When do you use social media? - Other - Text,What devices do you generally use to access social media? - Selected Choice,What devices do you generally use to access social media? - Other - Text,What are your main reasons for using social media? - Selected Choice,What are your main reasons for using social media? - Other - Text,Which of the following do you most often use as your main sources of news?  Select all that apply: - Selected Choice,Which of the following do you most often use as your main sources of news?  Select all that apply: - Other - Text,I feel comfortable being close friends with someone who holds very different political beliefs from me.,I use social media to consume news about political topics.,I frequently encounter political discussion online (whether or not I participate).,I frequently participate in political discussion online.,I feel safe expressing my opinions on social media.,Q1_8_TEXT - Parent Topics,Q1_8_TEXT - Topics,Q1_8_TEXT - Topic Hierarchy Level 1
"{""ImportId"":""startDate"",""timeZone"":""America/Denver""}","{""ImportId"":""endDate"",""timeZone"":""America/Denver""}","{""ImportId"":""status""}","{""ImportId"":""ipAddress""}","{""ImportId"":""progress""}","{""ImportId"":""duration""}","{""ImportId"":""finished""}","{""ImportId"":""recordedDate"",""timeZone"":""America/Denver""}","{""ImportId"":""_recordId""}","{""ImportId"":""recipientLastName""}","{""ImportId"":""recipientFirstName""}","{""ImportId"":""recipientEmail""}","{""ImportId"":""externalDataReference""}","{""ImportId"":""locationLatitude""}","{""ImportId"":""locationLongitude""}","{""ImportId"":""distributionChannel""}","{""ImportId"":""userLanguage""}","{""ImportId"":""QID16_1""}","{""ImportId"":""QID14""}","{""ImportId"":""QID14_8_TEXT""}","{""ImportId"":""QID2""}","{""ImportId"":""QID6""}","{""ImportId"":""QID3""}","{""ImportId"":""QID3_6_TEXT""}","{""ImportId"":""QID4""}","{""ImportId"":""QID4_4_TEXT""}","{""ImportId"":""QID5""}","{""ImportId"":""QID5_8_TEXT""}","{""ImportId"":""QID7""}","{""ImportId"":""QID7_8_TEXT""}","{""ImportId"":""QID8""}","{""ImportId"":""QID10""}","{""ImportId"":""QID11""}","{""ImportId"":""QID12""}","{""ImportId"":""QID13""}","{""ImportId"":""QID14_8_TEXT_95e579e5_cg0zaxi0gw5dParTopics""}","{""ImportId"":""QID14_8_TEXT_95e579e5_cg0zaxi0gw5dTopics""}","{""ImportId"":""QID14_8_TEXT_95e579e5_cg0zaxi0gw5dTopicHierarchy1""}"
2025-12-02 14:10:48,2025-12-02 14:14:01,IP Address,199.111.64.88,100,192,True,2025-12-02 14:14:02,R_5dN44LFrYqdWw93,,,,,38.3,-77.4739,anonymous,EN,3018,"Instagram,TikTok",,Less than once a month,Every day,Throughout the day,,Phone,,"To stay in touch with friends or family,For entertainment",,"Television news broadcasts,Friends or family",,Neutral,Disagree,Disagree,Strongly disagree,Disagree,,,
2025-12-02 14:10:49,2025-12-02 14:14:11,IP Address,199.111.64.88,100,201,True,2025-12-02 14:14:11,R_5DRCNngrC1nWIle,,,,,38.3,-77.4739,anonymous,EN,3027,"Instagram,Facebook,TikTok,Other",YikYak,Less than once a month,Every day,"Relaxing,Throughout the day,During meals,While commuting or walking,Before bed or when waking up",,Phone,,"To stay in touch with friends or family,To learn about specific topics or hobbies,For entertainment",,"Television news broadcasts,Friends or family,Social media (X, Instagram, Reddit, Facebook, TikTok, TruthSocial, Bluesky, or others)",,Agree,Disagree,Disagree,Strongly disagree,Strongly disagree,,Unknown,
2025-12-02 14:10:48,2025-12-02 14:14:38,IP Address,199.111.64.88,100,229,True,2025-12-02 14:14:38,R_5h4k7kX2oiL3hyY,,,,,38.3,-77.4739,anonymous,EN,3036,"X (Twitter),Instagram,Reddit,TikTok",,A few times per month,Every day,"Relaxing,Throughout the day,Before bed or when waking up",,Phone,,"To stay in touch with friends or family,To learn about specific topics or hobbies,For entertainment",,"Television news broadcasts,Social media (X, Instagram, Reddit, Facebook, TikTok, TruthSocial, Bluesky, or others)",,Neutral,Disagree,Agree,Strongly disagree,Disagree,,,
2025-12-02 14:10:49,2025-12-02 14:14:49,IP Address,199.111.64.88,100,239,True,2025-12-02 14:14:50,R_3bHDq6QhbfEFf33,,,,,38.3,-77.4739,anonymous,EN,3009,"X (Twitter),Instagram,Facebook",,Less than once a month,A few times per month,"Relaxing,Before bed or when waking up",,Phone,,"To stay in touch with friends or family,To follow news or current events,For entertainment",,"Online articles or posts from other sources (e.g., blogs, social media, independent websites),Social media (X, Instagram, Reddit, Facebook, TikTok, TruthSocial, Bluesky, or others)",,Disagree,Agree,Agree,Strongly disagree,Disagree,,,
